{"format":"satnet-edu.trace","schema_version":"1.0.0","producer":{"name":"satnet-edu","version":"0.1.0","source_zip_sha256":"93bca9f4c25352f3d8320bcb809ad3d593c91bf697b722a4e830a2e24ecdb2dc","dependencies":{"ephem":"4.2.1","sgp4":"2.27","astropy":"8.0.1"}},"experiment":{"id":"dc9f4f637f4050b3","name":"Minimal valid trace","epoch_utc":"2000-01-01T00:00:00Z","seed":42,"scenario":{"format":"satnet-edu.scenario","schema_version":"1.0.0","name":"Minimal valid trace","epoch_utc":"2000-01-01T00:00:00Z","seed":42,"limits":{"max_nodes":512,"max_samples":10000},"constellations":[],"objects":[{"id":"A","kind":"ground_station","label":"A","lat_deg":0,"lon_deg":0}],"link_policy":{"topology":"orbital_neighbors","max_isl_km":4000,"min_elevation_deg":10},"failures":[]}},"model":{"propagator":"UserGS synthetic TLE + PyEphem SGP4/SDP4","earth_model":"sphere","earth_radius_km":6378.16,"latitude_kind":"geocentric","coordinate_frame":"ECEF","units":{"length":"km","angle":"deg","time":"s","delay":"ms"},"c_km_s":299792.458,"tle_gravity_model":"WGS72","orbit_radius_constant_m":6378100.0,"orbit_mu_m3_s2":398600400000000.0,"link_policy":{"topology":"orbital_neighbors","max_isl_km":4000,"min_elevation_deg":10},"delay_model":"one-way propagation only","limitations":["No queues, traffic, processing, protocol convergence or energy model","Spherical educational link geometry"]},"recording":{"start_s":0,"end_s":0,"step_s":1,"sample_count":1,"route_queries":[],"capabilities":{"routes":false,"energy":false,"packet_events":false}},"objects":[{"id":"A","kind":"ground_station","label":"A","lat_deg":0,"lon_deg":0}],"frames":[{"t_s":0,"node_states":[{"id":"A","enabled":true,"position_ecef_km":[6378.16,0.0,0.0],"lat_deg":0,"lon_deg":0,"altitude_km":0.0}],"links":[],"routes":[]}],"events":[]}